"D Bm D Bm G Bm Em Bm Em Bm Gmaj7 F#7 Bm Cm G Bm Cm Bm Cm C"	"1982 Tab by Paul McCartney - E-Chords"	"cifra/idmusica/11168/keyb/true.htm"
"A D A D A E7 D A E7 A A A A D A D A E7 D A E7 A A A A D A D A E7 D A E7 A A A A D A D A D E7 A"	"3 Legs Tab by Paul McCartney - E-Chords"	"cifra/idmusica/76852/keyb/true.htm"
"E7(b9) Am E7 F E7 F Gm7 A A Dm C F6 G E7(b9) Am E7 F E7 F Gm7 A A Dm C F6 G A C#m F#m Bm A C#m F#m Bm F G E7(b9) Am E7 F E7 F Gm7 A A Dm C F6 G A C#m Bm A C#m Bm A E7(b9) Am E7 F E7 F Gm7 A A Dm C F6 G A"	"A certain softness Tab by Paul McCartney - E-Chords"	"cifra/idmusica/75664/keyb/true.htm"
"Bm Em Bm Em D G F# D A Bm G D A Bm G D A"	"About You Tab by Paul McCartney - E-Chords"	"cifra/idmusica/133979/keyb/true.htm"
"E E A E A B E"	"Ain't That A Shame Tab by Paul McCartney - E-Chords"	"cifra/idmusica/133980/keyb/true.htm"
"F#m B7 E C#m A F#m D B7 F#m B7 E C#m A B7 E C#m Cm7+ C#m7 C#m Cm7+ E C#m Cm7+ E"	"All my loving Tab by Paul McCartney - E-Chords"	"cifra/idmusica/38869/keyb/true.htm"
"E B Bb G E E E E E B Bb G E"	"Angry Tab by Paul McCartney - E-Chords"	"cifra/idmusica/133981/keyb/true.htm"
"G B7 Em Am D G C G C G C G A7 D G D G C Am D G E7 Am D G D/F# Em Em C7M A/C# C7M Em C7M A/C# C7M Em E Am D D5+ Bm/D B7 Em C A/C# C Em G F C G"	"Another Day Tab by Paul McCartney - E-Chords"	"cifra/idmusica/90593/keyb/true.htm"
"G Em C G G Em C G G Em C G G Em C G G Em C G G Em C G Bm/E Am6/F# E7/G# Am Am D/A Am D/A D F#m7 Bm G7 F#m7 Em7 D/A A D/A A G Em C G G Em C G G Em C G G Em C G G Em C G Bm/E Am6/F# E7/G# Am Am D/A Am D/A D F#m7 Bm G7 F#m7 Em7 D/A A D/A A D F#m7 Bm G7 F#m7 Em7 D"	"Anyway Tab by Paul McCartney - E-Chords"	"cifra/idmusica/75669/keyb/true.htm"
"C7 D D(b5) D6 Em Em(b5) D D(b5) G7/D D D F#m Bm Bm(b5) G D/F# F#7/E Bm D Bm/C# Bm Bm(b5) Bm Bm(b5) Bm C7 D D(b5) D6 Em Em(b5) D D(b5) G7/D D D A G D G D A D A/C# G/B D/A G D/F# A/E D D F#m Bm Bm(b5) G D/F# F#7/E Bm D Bm/C# Bm Bm(b5) Bm Bm(b5) Bm C7 D D(b5) G7/D D"	"At the mercy Tab by Paul McCartney - E-Chords"	"cifra/idmusica/75660/keyb/true.htm"
"G A A D A Em A A D A C A C A A Dm A A Dm A Dm G Dm A Dm A Dm A Dm Dm A Dm A Dm G A Dm A Dm A Dm G A A C A Dm A Dm A Dm G G Bb F E Dm A Dm A Dm G A Dm A C A C A C"	"Average Person Tab by Paul McCartney - E-Chords"	"cifra/idmusica/133982/keyb/true.htm"
"C Dm C Em C Dm C Em C Dm C Em C Dm C Em C Dm C Em C Dm C Em C Dm C Em C Dm C Em C Dm C Em C Dm C Em C Dm C Em C Dm C Dm G Dm G Em Em Em C Dm C Em C Dm C Em C Dm C Em C Dm C Em C Dm C Em C Dm C Em C Dm C Em C Dm C Em C Dm C Em C Dm C Em C Dm C Em C Dm C Dm G Dm G Em Em Em C Dm C Em C Dm C Em C Dm C Em C Dm C Em C Dm C Em C Dm C Em C Dm C Em C Dm C Em C Dm C Em C Em"	"Back in the sunshine again Tab by Paul McCartney - E-Chords"	"cifra/idmusica/81201/keyb/true.htm"
"E A D C D A D C D A C D A D Eb E G9 A D A D A/C# C B7 E7 D7 A D Eb E"	"Back in The USSR Tab by Paul McCartney - E-Chords"	"cifra/idmusica/29490/keyb/true.htm"
"B7 B7 E7 B7 E7 Ab7 E7 B7 B7 E7 B7 E7 B7 E7 B7 E7 A7 B7 E7 B7 C7 D7 B7 B7 E7 B7 B7 E7 B7 E7 B7 C7 D7 B7"	"Ballroom Dancing Tab by Paul McCartney - E-Chords"	"cifra/idmusica/133983/keyb/true.htm"
"Dmaj7 Dmaj7 G G Dmaj7 G Dmaj7 G Dmaj7 D G6 G6 Dmaj7 D G6 G6 Dmaj7 G6 Dmaj7 G6 Dmaj7 G6 D Gm6 D Gm6 Dmaj7 Gm6 Am D Am D Am Am C D C D C C C Fmaj7 C Fmaj7 C Fmaj7 Fmaj7 C C Fmaj7 Fmaj7 Em G C Em Am F C F Fmaj7 C F C F C F C F C Fmaj7 Fmaj7 C C Fmaj7 Fmaj7 Em G C Em G Am F C F Fmaj7 C F C F G Em C Em G Am Fmaj7 C G Em C C F C F C F C F C Fmaj7 Fmaj7 C C Fmaj7 Fmaj7 Em G C Em G Am F F C C F Fmaj7 C F C F C F C F G Em C"	"Band on the Run Tab by Paul McCartney - E-Chords"	"cifra/idmusica/11169/keyb/true.htm"
"E E A E B A E E A B E E E E"	"Be Bop A Lula Tab by Paul McCartney - E-Chords"	"cifra/idmusica/133984/keyb/true.htm"
"A Esus4 E A D Esus4 E A A7 D Dm A E A Esus4 E A Esus4 E A D Esus4 E A A7 D Dm A E A Dm G C F Dm Esus4 E A Dm G C F Dm Esus4 E A Esus4 E A Esus4 E A D Esus4 E A A7 D E A E A F#m A F#m D A F#m A F#m D A Dm G C F Dm Esus4 E A Dm G C F Dm Esus4 E A Esus4 E A Esus4 E A A F#m D A"	"Beautiful night Tab by Paul McCartney - E-Chords"	"cifra/idmusica/81210/keyb/true.htm"
"Em7 A Em7 A Em7 A Em7 A Em7 A A G Em7 A Em7 A Em7 A Em7 G C Em A Em7 A Em7 A G C Em A Em7 A Em7 A Em7 A Em7 A Em7 A Em7 A A G Em7 A Em7 A Em7 A Em7 G C Em A Em7 A Em7 A G C Em A Em7 A Em7 A Em7 A Em7 A Em7 A Em7 G C Em A Em7 A Em7 A G C Em A Em7 A Em7 A G C Em A Em7 A Em7 A G C Em A Em7 A Em7 A G C Em A Em"	"Biker like a icon Tab by Paul McCartney - E-Chords"	"cifra/idmusica/82257/keyb/true.htm"
"Em7 A Em7 A Em7 A Em7 A Em7 A Em7 A G Em7 A Em7 A Em7 A Em7 Cadd9 C Asus2 B7 Em Cadd9 C Asus2 B7 Em Em7 A Em7 A Cadd9 C Asus2 B7 Em Cadd9 C Asus2 B7 Em"	"Biker Like An Icon Tab by Paul McCartney - E-Chords"	"cifra/idmusica/29491/keyb/true.htm"
"E A E B7 A E G A B C D E A E B7 A E G A B C D"	"Bip Bop Tab by Paul McCartney - E-Chords"	"cifra/idmusica/133985/keyb/true.htm"
"A D A E A A D A E A E E E E C G C G C G C G E A D A E A A G A G C G C G C G C A D A E A A"	"Birthday Tab by Paul McCartney - E-Chords"	"cifra/idmusica/79107/keyb/true.htm"
"Gm Fm Bb6 Fm Bb Ebmaj7 Ab Ebmaj7 Ab7 Ebmaj7 Ab6 Ebmaj7 Ab6 Cm Cm/Bb Dm7 G7 Cm Cm/Bb Dm7 G7 Ab Ebmaj7 Ebmaj7 Ab Cm Cm/Bb Dm7 G7 Cm Cm/Bb Dm7 G7 Ab Ebmaj7"	"Bluebird Tab by Paul McCartney - E-Chords"	"cifra/idmusica/11171/keyb/true.htm"
"A D A A D A A D A D A D A D A E D A A D A E D A D A D A D A E D A A D A E D A D A D A D A E D A"	"Bluejean Bop Tab by Paul McCartney - E-Chords"	"cifra/idmusica/90594/keyb/true.htm"
"A A D E E A A D E Dm A E Dm A Dm A Dm A Dm A A D E Dm Dm A A D A E A A Dm A Dm Dm A Dm Dm A Dm A Dm A Dm A Dm A Dm A Dm A Dm A"	"Bogey Music Tab by Paul McCartney - E-Chords"	"cifra/idmusica/133986/keyb/true.htm"
"G G7 G G G C D G C D G"	"Brown Eyed Handsome Man Tab by Paul McCartney - E-Chords"	"cifra/idmusica/133987/keyb/true.htm"
"C E Am F C G C C E Am F C G C C C C C E Am F C G C C C C Dm C G/B Gm/B Dm C G/B Gm/B Am7 D7 C C C C C C C C C C C C C C C C C C C C C C C C"	"C Moon Tab by Paul McCartney - E-Chords"	"cifra/idmusica/29492/keyb/true.htm"
"Eb Eb+ Eb Eb+ Ab Gm7 Cm Ab Bb C Csus4 Csus2 C C7 C6 Cmaj7 C C7 C6 Cmaj7 C C7 C6 Cmaj7 C C7 C6 Cmaj7 C Ab6 Gm7 Cm Ab6 Gm7 Cm Gm7 Cm Ab6 Gm7 Cm Ab6 Gm7 C C7 C6 Cmaj7 C C7 C6 Cmaj7 C C7 C6 Cmaj7 C C7 C6 Cmaj7 C C7 C6 Cmaj7 C C7 C6 Cmaj7 C Gm/C C"	"C'mon People Tab by Paul McCartney - E-Chords"	"cifra/idmusica/29493/keyb/true.htm"
"Dm C Gm C Dm Gm Dm Gm Dm Gm Dm Gm Dm Gm C Gm Dm A7 D Dm Gm C Gm Dm A7 D Gm Dm Gm D A7 Dm Gm C Gm Dm A7 D Gm Dm Gm Gm D A7 Dm Gm C Gm Dm A7 D Dm Gm Dm Gm D A7 Dm Gm C Gm Dm A7 D Dm C Gm C Dm Gm"	"Cafe on the left bank Tab by Paul McCartney - E-Chords"	"cifra/idmusica/87999/keyb/true.htm"
"Em Am Em Am Dm G7 C7 F7 C7 G7 F7 G7 F7 C7 Em Am Dm G7 C Em Am Dm7 G7 C7 C7 Em Am Em Am Dm7 Gm7 C7"	"Can't Buy Me Love Tab by Paul McCartney - E-Chords"	"cifra/idmusica/29495/keyb/true.htm"
"Am7 Dm G C/G F7M Dm E Am7 G C Em7 Am G/Bb F G C C Am G C G C G C Em"	"Carry that weight Tab by Paul McCartney - E-Chords"	"cifra/idmusica/38870/keyb/true.htm"
"G C G G D G G Am Em C G C G G C G G D G G C G D G C G D G C G D Em C G D G C G D G G C G G D G G C G G D G G C G G D G C G D G C G D Em C G D G C G D G G C G G C G C G C G G C G G D G G C G D G C G D G C G D Em C G D G C G D G"	"Children Tab by Paul McCartney - E-Chords"	"cifra/idmusica/80859/keyb/true.htm"
"E A Bm E E A Bm E A Bm E A Bm E A Bm C#m D E F#m G G# A Bm C#m D E F#m G G# A E"	"Coming Up Tab by Paul McCartney - E-Chords"	"cifra/idmusica/31322/keyb/true.htm"
"E F# A E E F# A E E F F# F E F F# F E F F# F E F F# F"	"Cosmically Conscious Tab by Paul McCartney - E-Chords"	"cifra/idmusica/133988/keyb/true.htm"
"C F C G C G C F C A7 D7 G C A7 D7 G C G Am G F C Am G F G D7 G C G C"	"Country Dreamer Tab by Paul McCartney - E-Chords"	"cifra/idmusica/133989/keyb/true.htm"
"E A B E A B E A B E A B E A B E A B E A B E A B E A B"	"Crackin Up Tab by Paul McCartney - E-Chords"	"cifra/idmusica/133990/keyb/true.htm"
"F C F C Bb C F F C F C Bb C F Eb F Eb C C7 F C F C Bb C F F C F C Bb C F"	"Dance Tonight Tab by Paul McCartney - E-Chords"	"cifra/idmusica/109202/keyb/true.htm"
"F F F F F"	"Darkroom Tab by Paul McCartney - E-Chords"	"cifra/idmusica/133991/keyb/true.htm"
"C F G F G C F Dm Am Bb Bb F Bb F C G F C F C G F G Bb F Bb F C Am7 Dm7 G7 Cm Gm Cm Gm Cm Gm Ab Gm Fm Cm Fm Cm Fm Cm Db G Cm Gm Cm Gm Cm Gm Cm C G F C F C C G F G Bb F Bb F C Am7 Dm7 G7 C Cmaj7 C6 Cmaj7 F C D9 G7 C F Em Dm7 C"	"Daytime Nightime Suffering Tab by Paul McCartney - E-Chords"	"cifra/idmusica/29496/keyb/true.htm"
"Gm Am A Dm Gm Gm Am A Dm Gm Am A Dm Gm Gm Am A D Bb C Dm D# F Bb Dm Gm Bb Gm Gm Am A Dm Gm Gm Am A Dm Gm Am A Dm Gm Gm Am A D Bb C Dm D# F Bb Dm Gm Bb Gm Gm Am Bm B Em Am Am Bm B Em Am Bm B Em Am Gm Am Gm Am A Dm Gm Gm Am A D Bb C Dm D# F Bb Dm Gm Bb C Dm D# F Bb Dm Gm Bb"	"Distractions Tab by Paul McCartney - E-Chords"	"cifra/idmusica/81217/keyb/true.htm"
"D A D G/A D7 Em B7 Em Asus4 A D A D D7 Em B7 Em A C#m C Bm F#m C#m C#m C Bm F#m G C G F Em A A D A C#m C Bm Bb Gm D"	"Don't Be Careless Love Tab by Paul McCartney - E-Chords"	"cifra/idmusica/11172/keyb/true.htm"
"E A E D7 C#m F#m B7 E A E A E F#m B7 B7 B7"	"Don't Get Around Much Anymore Tab by Paul McCartney - E-Chords"	"cifra/idmusica/121817/keyb/true.htm"
"Em Dm Cm Bm Dm Em G Am Bm C D E Em Em A"	"Dress Me Up As A Robber Tab by Paul McCartney - E-Chords"	"cifra/idmusica/133992/keyb/true.htm"
"F# Bm F# Bm A G A D Gmaj7 D Gmaj7 Bb C D D Gmaj7 D Gmaj7 Bb C C#7 D Gmaj7 D Gmaj7 D Gmaj7 G A"	"Driving Rain Tab by Paul McCartney - E-Chords"	"cifra/idmusica/11157/keyb/true.htm"
"C Bb C F Gm C F Gm C F Gm C F C Bb C F Dm C Bb F C Eb Ebº D Gm C F Gm C F Gm C F Gm C F Dsus D G Am D G Am D G Am D G Bb C G Am D G Am D G Am D G Bb C F F Dm C Bb F C Eb Ebº D Gm C F Gm C F Gm C F Gm C F Dsus D Gm C F Gm C F Gm C"	"Ebony and Ivory Tab by Paul McCartney - E-Chords"	"cifra/idmusica/38872/keyb/true.htm"
"C/G Em Em C6 Em C6 Em Em7 Em6 C Em Em7 Em6 C Em"	"Eleanor Rigby Tab by Paul McCartney - E-Chords"	"cifra/idmusica/29497/keyb/true.htm"
"A A C#m Bm A Bm A Bm A Bm A Bm F#m F F Am Dm Bb F Am Bb F Am A7 F A7 F A7 F C F F Am Dm Bb F Am Bb F F Am A7 F A7 F A7 F C F C F C F"	"End Of The End Tab by Paul McCartney - E-Chords"	"cifra/idmusica/110800/keyb/true.htm"
"G D/F# G7/F Em B/D# Bm/D A/C# Dsus4 D G D/F# G7/F Em B/D# Bm/D A/C# Dsus4 D C Am D G C Am D G C Am D G C Am D G D/F# G7/F Em B/D# Bm/D A/C# Dsus4 D G D/F# G7/F Em B/D# Bm/D A/C# Dsus4 D C Am D G C Am D G C Am D G C Am D Em/D D G D/F# G7/F Em B/D# Bm/D A/C# Dsus4 D G F# F E Eb D C# D G"	"English Tea Tab by Paul McCartney - E-Chords"	"cifra/idmusica/75662/keyb/true.htm"
"Dm C/G Dm C/G F C/G Dm Am F C/G Dm C/G Dm C/G Dm F F C/G Dm Am F C/G Dm C/G Dm C/G Dm F C/G G F C/G G F C/G G F Em Dm F C/G F C/G F C/G Am Am7 F Am Am7 F F C/G F C/G C/G Dm Am F C/G Dm C/G Dm7 C/G Dm F C/G G F C/G G F C/G G F Em Dm C/G G F C/G G F C/G G F Em Dm7 C/G"	"Ever present past Tab by Paul McCartney - E-Chords"	"cifra/idmusica/114416/keyb/true.htm"
"E7 E7sus4 E7 E7sus4 A F#m Bm F#7 B A G#m F#m E E F#m7 B7 E A E B7 E A E B7 E A E B7 E A E B7"	"Every Night Tab by Paul McCartney - E-Chords"	"cifra/idmusica/11173/keyb/true.htm"
"E E7 A Bm C# A G#m Bm C# A G#m E E7 Bm C# A G#m A E Bm C#"	"Feet In The Clouds Tab by Paul McCartney - E-Chords"	"cifra/idmusica/134119/keyb/true.htm"
"E A E A G F#m E A E A G F#m E A/E E A/E E B C#m A B A B G#m7 Amaj7/C# A B G#m7 B Bsus4 A B G#m7 Amaj7/C# F#m7 B E A E A G F#m E A E A G F#m"	"Figure Of Eight Tab by Paul McCartney - E-Chords"	"cifra/idmusica/29498/keyb/true.htm"
"A A Fmaj7 A Fmaj7 A D E7 A D E7 A Fmaj7 A A Fmaj7 A Fmaj7 A Fmaj7 Fmaj7 A Fmaj7 A D E7 A D E7 A A Fmaj7"	"Fine line Tab by Paul McCartney - E-Chords"	"cifra/idmusica/72946/keyb/true.htm"
"C Cmaj7 Am Asus2 F C Am Em F C C Cmaj7 Am Asus2 F C Am Em F C A D Db5 D6/9 D D Db5 D6/9 Am F Am F C Cmaj7 Am Asus2 F C Am Em F C A C A C A D"	"Follow me Tab by Paul McCartney - E-Chords"	"cifra/idmusica/75666/keyb/true.htm"
"Em Am G D D G G Em C D D G Em Am G D D G G G/F# Em C D D G Em Am G D G Em Am G D G"	"Freedom Tab by Paul McCartney - E-Chords"	"cifra/idmusica/11167/keyb/true.htm"
"E Bm B6 E E7 A Am E B E E Bm B6 E E7 A Am E B6 B7 E E7 A Am E F#m7 C#m C G F#m7 F#m7 B7 E Bm B E E7 A Am E B6 B7 E E7 B6 B7 E E7 A Am E F#m7 C#m C G F#m7 F#m7 B E Bm B6 E E7 A Am E B6 B7 E B6 B7 E E7 A Am E E"	"Friends to go Tab by Paul McCartney - E-Chords"	"cifra/idmusica/75661/keyb/true.htm"
"E Bm B6 E E7 A Am E B6 B7 E E Bm B6 E E7 A Am E B6 B7 E E7 A Am E F#m C#m C G F#m7 B7 F#m7 B7 E Bm B6 E E7 A Am E B6 B7 E E7 B6 B7 B6 B7 E E7 A Am E F#m7 C#m C G F#m7 B7 F#m7 B7 E Bm B6 E E7 A Am E B6 B7 E B6 B7 B6 B7 E A E"	"Friends To Go (ver. 2) Tab by Paul McCartney - E-Chords"	"cifra/idmusica/108965/keyb/true.htm"
"C Fm C Fm C Fm C Fm C Fm C Fm C Fm Am F C G Dm F C G Dm Am Dm G Dm Am Dm"	"From A Lover To A Friend Tab by Paul McCartney - E-Chords"	"cifra/idmusica/11156/keyb/true.htm"
"D7 A E7 A D7 E A F#m D A E F#m D A F#m D A E F#m D A D7 A E A D7 A E A D7 A"	"Get Out Of My Way Tab by Paul McCartney - E-Chords"	"cifra/idmusica/29499/keyb/true.htm"
"F9 C F/G G C/G G C/G G C/G G C/G G C/G G C/G G C/G G C/G C F Em F C F Em F G C/G F C/E F C/E F C/E F C/E C C Em F C Em F G G"	"Getting Better Tab by Paul McCartney - E-Chords"	"cifra/idmusica/29500/keyb/true.htm"
"C Em Am F G C G C Em Am F G C F G G C Em Am F G C G C Em Am F G C F G G C Em Am F G C G C Em Am F G C F G G"	"Goodbye Tab by Paul McCartney - E-Chords"	"cifra/idmusica/140069/keyb/true.htm"
"F Dm7 Gm7 C7/9- F Dm9 Gm7 C7/9- F Dm9 Gm7 C7/9- F Fm7 C7/9- F F Dm7 Gm7 C7/9- F Dm7 Gm7 C7/9- F Dm7 Gm7 C7/9- F F Dm7 Gm7 C7/9- F Dm7 Gm7 C7/9- F Dm7 Gm7 C7/9- Fm7 C F Dm7 Gm7 C7/9- F Dm9 Gm7 C7/9- F Dm9 Gm7 C7/9- C7 F Dm7 Gm7 C7/9- F Dm7 Gm7 C7/9-"	"Goodnight Tonight Tab by Paul McCartney - E-Chords"	"cifra/idmusica/29501/keyb/true.htm"
"E Esus4 E E Esus4 E C#m C#m7 F#7 F#m7 Bsus4 B E Esus4 E E Esus4 E C#m C#m7 F#7 F#m7 Bsus4 B B A E B B A E B E B A E B B A E B E Asus4 A Am E Esus4 Bsus4 B E Esus4 E E Esus4 E C#m C#m7 F#7 F#m7 Bsus4 B B A E B B A E B E B A E B B A E B E Asus4 A Am E Esus4 Bsus4 B E Esus4 E Esus4 E C#m C#m7 F#7 F#m7 Bsus4 B E Esus4 E E Esus4 Esus E"	"Heather Tab by Paul McCartney - E-Chords"	"cifra/idmusica/11163/keyb/true.htm"
"C G Am G Am Dm Am G Dm G C E7 Am Gm F C E7 Am Gm F C E7 Am Am G Am Dm Am G Dm G C E7 Am Gm F C E7 Am Gm F C E7 Am Gm F C E7 Am Am Dm Am Am G Am Dm Am G Dm G C E7 Am Gm F C E7 Am Gm F C E7 Am Gm F C E7 Am Gm F C E7 Am Gm F C E7 Am Gm F C E7 Am Gm F C E7 Am Gm F Am Am G"	"Heaven on a sunday Tab by Paul McCartney - E-Chords"	"cifra/idmusica/81211/keyb/true.htm"
"F C G7 Am G7 Am G7 F C Em Am G F G# C Em Am G F Bb C F G# Cm D/F# F C"	"Hello, Goodbye Tab by Paul McCartney - E-Chords"	"cifra/idmusica/29502/keyb/true.htm"
"Em/C# C7+ Em/C# C7+ Em Em/G Em/F# Em Cm C9 Cm G Em/C# C7+ Em Em/G Em/F# Em Cm C9 Cm G C/G F C/G F C/G Am Em C/G Am Em F D7 G Ddim Em Am D7 Em Ddim Em Am D7 Em Em/C# C7+ Em Em/G Em/F# Em Cm C9 Cm G Cm C9 Cm G G4/7 G"	"Here Today Tab by Paul McCartney - E-Chords"	"cifra/idmusica/11174/keyb/true.htm"
"G Bm Bb Am7 D7 G Am Bm C G Am Bm C F#m B7 F#m B7 Em Am7 D7(4) D7 F Bb Gm Cm D7 Gm Cm D7"	"Here, there, and everywhere Tab by Paul McCartney - E-Chords"	"cifra/idmusica/29503/keyb/true.htm"
"F C C7 C7(4) F Bb F C F Bb Bb/A Gm Gm/F C/E C F F7 Bb Bb/A Gm Gm/F C/E C F C C7 F Eb Bb F"	"Hey Jude Tab by Paul McCartney - E-Chords"	"cifra/idmusica/29504/keyb/true.htm"
"B E B E B E B E A E A E B E B E A E B E B E B E B E B E A E B E B E B E A E B C B E B E B E A E B C B E"	"HI HI HI Tab by Paul McCartney - E-Chords"	"cifra/idmusica/76846/keyb/true.htm"
"G Em G Em G Em Am G Em Am G Em G Em G Em Am G Em Am Em Am Em Am C Em/B Am C/G C Em/B C Cadd9 Em/B C Em/B Am C/G G Em G Em G Em Am G Em Am Em Am Em Am C Em/B Am C/G C Em/B C Cadd9 Em/B C Em/B Am C/G G Em G Em G Em Am G Em Am Em Am Em Am C Em/B Am C/G C Em/B C Cadd9 Em/B C Em/B Am C/G G Em G Em C Em/B C Cadd9 Em/B C Em/B Am C/G G Em G Em G Em G Em G Em C Am C Am C Am Dm7 C Am Dm7 C Am C Am Dm7 Am Dm7 Am Dm7 F Am Dm Dm/C F Am F Am F Am Dm Dm7/C C Am C Am C Am Dm7 Am Dm Am Dm F Am/E Dm Dm7/C C Am C Am C Am C Am C Am C Am C"	"Hope of Deliverance Tab by Paul McCartney - E-Chords"	"cifra/idmusica/29505/keyb/true.htm"
"E A F#m A F#m A F#m C#m Em C#m Em C#m Bm Dm6 A A F#m A F#m A F#m C#m Em C#m Em C#m Em Bm/F Dm6/F A/E A C#m Em C#m Em Bm/F Dm6/F A/E A Am Bm C Bm Am Bm C Bm Am Bm C Bm Esus4 E A F#m A F#m A F#m C#m Em C#m Em/A C#m Em/A Bm Dm6 A C#m Em/A C#m Em/A Bm/F Dm6/F A Am Bm C Bm Am Bm C Bm Am Bm C Bm Esus4 E A F#m A F#m A F#m A F#m F#m F E F E Fmaj7 E A"	"How kind of you Tab by Paul McCartney - E-Chords"	"cifra/idmusica/75658/keyb/true.htm"
"G Am G Am G Am Bm E Esus4 Am Bm Am Bm C D G F G G7 C G Am7 G G7 C G Am7 G F Em D G Am G Am G Am G Am"	"How Many People Tab by Paul McCartney - E-Chords"	"cifra/idmusica/11175/keyb/true.htm"
"D A Gº Bm G D Em A7 A7 Aº Em A D F#m Aº Em Em7 A7 A7 D A Gº Bm G D Em A7 A7 Aº Em A D F#m Aº Em Em7 A7 A7 D Em D Em D Em D G A D A Gº Bm G D Em A7 A7 Aº Em A D F#m Aº Em Em7 A7 A7 D D A"	"I Do Tab by Paul McCartney - E-Chords"	"cifra/idmusica/11159/keyb/true.htm"
"D A B B7 E E7 A A7 A E B A E B E A E A E E E7 A A7 D A B B7 E E7 A A7 D A B B7 E E7 A A7 D A B B7 A E B A E B A E B E A E A E A E A E E E7 A A7 D A B B7 E E7 A A7 D A B B7 E E7 A A7 D A B B7 A E B A E B A E B E A E E E7 A A7 D A B B7 E E7 A A7 D A B B7 E E7 A A7 D A B B7 E E7 A A7 D A B B7"	"I lie around Tab by Paul McCartney - E-Chords"	"cifra/idmusica/81213/keyb/true.htm"
"Am C/B C C/B Am C/B C C/B Am C/B C C/B Am C/B C C/B Am C/B C C/B Am F F C F C F Am G F Dm G C Am Dm G C Am C/B C C/B Am C/B C C/B G Am C/B C C/B"	"I Owe It All To You Tab by Paul McCartney - E-Chords"	"cifra/idmusica/29506/keyb/true.htm"
"E7 E A E B7 E E/G# A C E B7 E A B A E B7 E E B7 E A E7"	"I Saw Her Standing There Tab by Paul McCartney - E-Chords"	"cifra/idmusica/31323/keyb/true.htm"
"Em D Em D Em D Em D Em Em D Em D Em D Em D C Am Em C Am Em Em D Em D Em D Em D Em D Em D A Em D Em D Em D Em D Em D G Em Am D G B7"	"If You Wanna Tab by Paul McCartney - E-Chords"	"cifra/idmusica/29507/keyb/true.htm"
"Bb Bb/A Gm Gm/F Eb F Gm Bb Bb/A Gm Gm/F Eb F Gm F/A Bbm Bb Bb/A Gm Gm/F Eb F Gm F/A Bbm Bbm/Db Bbm Ebm Ebm7/Db F7 Bbm Bb/Db Ebm Ebm7/Db F7 Bbm Bb Bb/A Gm Gm/F Eb F Gm F/A Bbm Bbm Ab Eb/G Bbm Ab Eb/G Bbm Ab Eb/G Bb Bbm/Db Bbm Ebm Ebm7/Db F7 Bbm Bb/Db Ebm Ebm7/Db F7 Bbm Bb Bb/A Gm Gm/F Eb F Gm F/A Bbm Bbm/Db Bbm Ebm Ebm7/Db F7 Bbm Bb/Db Ebm Ebm7/Db F7 Bbm Bb/Db Ebm Ebm7/Db F7 Bbm Bbm Ab Eb/G Bbm Ab Eb/G Bbm Ab Eb/G Bb Bbm Eb Bb Eb Bb Eb Bb"	"Jenny Wren Tab by Paul McCartney - E-Chords"	"cifra/idmusica/75659/keyb/true.htm"
"Bm D6 Bm D6 C#m7 A D/A A A D/A A C#m7 Bm D6 A Bm E Bm E Bm A C#m Bm7 D6 A Bm D6 Bm D6 C#m7"	"Jet Tab by Paul McCartney - E-Chords"	"cifra/idmusica/11176/keyb/true.htm"
"Bm7 D6 Bm7 D6 C#m7 Bm7 D6 Bm7 D6 C#m7 Bm7 D6 A A D/A A D/A A D/A A A D/A A D/A A C#m7 Bm D6 A D/A A D/A A D/A A A D/A A D/A A C#m7 Bm D6 A A Bm E Bm E Bm A D/A A A D/A A A D/A A D/A A C#m7 Bm D6 A A Bm E Bm E Bm A D/A A A A D/A A A D/A A D/A C#m7 Bm D6 A C#m7 Bm D6 A Bm7 D6 Bm7 D6 C#m7 Bm7 C#m7 Amaj7"	"Jet Tab by Paul McCartney - E-Chords"	"cifra/idmusica/78300/keyb/true.htm"
"F#m C#7 F#m D D A F#m C#7 F#m D D A D A E7 A D A E7 A F#m C#7 F#m D D A E F#m C#7 F#m D D A D A E7 A D A E7 A F#m C#m F#m D A"	"Junk Tab by Paul McCartney - E-Chords"	"cifra/idmusica/11177/keyb/true.htm"
"Cm Fsus4 F Cm Fsus4 F Bb Eb G G7 Cm Fsus4 F Cm Fsus4 F Em B7 Em Em Em/D# Em/D C Cm G D Am D Am Em B7 Em Em A Em A D G B7 Em A Em A C B7 Em Am B7 Em B7 Em"	"Keep Under Cover Tab by Paul McCartney - E-Chords"	"cifra/idmusica/146747/keyb/true.htm"
"A D F G A A D A D A D F G A A D A D A D F G A Dm G C Am Dm G C Bm E4 E"	"Lady Madonna Tab by Paul McCartney - E-Chords"	"cifra/idmusica/29508/keyb/true.htm"
"Bb/A Bb/G D# Bb/A Bb/G Bbmaj7 Bb6 Bb D# Bb Bb D# Bb F7 Bb F7 Bb F7 Bb F7 F Am Adim Dm F Bb Bb D# Bb F7 Bb F7 Bb F7 Bb F7 F Am Adim Dm F Bb Bb D# Bb Bb D# Bb F7 Bb F7 Bb F7 Bb F F Am Adim Dm F Bb Bb D# Bb Bb D# Bb"	"Let em in Tab by Paul McCartney - E-Chords"	"cifra/idmusica/78299/keyb/true.htm"
"A F#m A F#m E A E A E A E A E F#m E F#m E F#m E F#m E F#m A F#m A F#m E E A E A E A E A E F#m E F#m E E F#m E F#m A F#m A F#m E E A E A E A E A E F#m E F#m E F#m E F#m A F#m A F#m E E A E A E A E A E F#m E F#m E F#m E F#m E F#m E F#m A F#m A F#m E E A E A E A E A E F#m E F#m E"	"Let Me Roll It Tab by Paul McCartney - E-Chords"	"cifra/idmusica/11178/keyb/true.htm"
"Am Dsus D Am Dsus D Dm7 Am Dm7 Am C D Am Dsus D Am Dsus D Dm7 Am Dm7 Am Am Bm Cm Fsus F Cm Fsus F Fm7 Cm Fm7 Cm Fm7 Cm Fm7 Cm"	"Letting Go Tab by Paul McCartney - E-Chords"	"cifra/idmusica/102571/keyb/true.htm"
"G C G G C G D6 Cmaj7 Bm7 Esus E Am Bm C Cm7 G C G G C G D6 Cmaj7 Bm7 Esus E Am Bm C Cmaj7 G C G C G C G Gmaj7 G7 C G Gmaj7 G6 G Gmaj7 G6 G C G G C G C G Gmaj7 G7 C G Gmaj7 G6 G Gmaj7 G6 G C G G C G C G Gmaj7 G7 C G Gmaj7 G6 G Gmaj7 G6 G C G G C G G G6 Gmaj7 G6"	"Listen To What The Man Said Tab by Paul McCartney - E-Chords"	"cifra/idmusica/147498/keyb/true.htm"
"D C D6 D Dm G7 C D6 D A Bm Bm F# Em A7 D F# Em A7 A D Bm F# Em7 A7 D D C D6 D Dm G7 C E F#m B7 E E7 A Em7 A7 F#m Em A7 F#m D F#m D F#m D E F#m B7 E E7 A Em7 A7 F#m E A7 F#m D6 D F#m D6 D F#m D6 D F#m D6 D D6 D A Bm F# Em7 A7 D D E F#m B7 E E7 A Em7 A7 F#m Em A7 F#m D F#m D F#m D F#m D D6 D A Bm Bm F# Em7 A7 D D C D6 D Dm G7 C"	"Little lamb dragonfly Tab by Paul McCartney - E-Chords"	"cifra/idmusica/81214/keyb/true.htm"
"G Bm C D D7(b9) G Bm C D D7(b9) G Bm C A7 D Bb G C A7 D G C A7 G C7 G7 D Em F"	"Live and let die Tab by Paul McCartney - E-Chords"	"cifra/idmusica/11179/keyb/true.htm"
"D/F# G F# B A E D/F# G F#/A B Em/G F#m7 E E F#m7 A/B E D/A A E B7 A E A E A Bm7 Amaj7/C# F#m7 Bm7 Esus4 E A F#m7 Edim/G E/G# A F#m7 Edim/G E/G# A D/F# G E/G# A Bm7 Amaj7/C# F#m7 Bm7 Esus4 E A F#m7 Edim/G E/G# A F#m7 Edim/G E/G# A E F#m7 A/B E D/A A E B7 A E A E Fm7 Edim/G E/G# A A G D A"	"Lodon Town Tab by Paul McCartney - E-Chords"	"cifra/idmusica/134503/keyb/true.htm"
"C Em C Em C G D C Bm Am Em Am Em Am Em Am B7"	"Lonely Road Tab by Paul McCartney - E-Chords"	"cifra/idmusica/29509/keyb/true.htm"
"C E7 F G C C7 F Fm C C/B Am Dm7 G C G7 C E7 F G C C7 F Fm C C/B Am F G C C7 F Em F G C C7 F Fm E7 Am D G G7 C E7 F G C C7 F Fm C C/B Am Dm7 G C C7 C E7 F G C C7 F Fm C C/B Am Dm7 G C F C G C"	"Lonesome Town Tab by Paul McCartney - E-Chords"	"cifra/idmusica/38873/keyb/true.htm"
"G C G G C G D7 C7 C7 C G F Bb D7 G F Bb D7 G F Bb D7 G F Bb D7 G Cm G7 Cm G7 G F C G G F C G G F C G G F C G"	"Long Haired Lady Tab by Paul McCartney - E-Chords"	"cifra/idmusica/134504/keyb/true.htm"
"E A A A E A D A E A E A E A A E A E A D D2 Dsus4 D A"	"Long Leather Coat Tab by Paul McCartney - E-Chords"	"cifra/idmusica/134505/keyb/true.htm"
"C A Bb G C F C F C A Bb G C F C F C A Bb F C A Bb F C A Bb Gm C F C F C A Bb F C A Bb F C A Bb Gm F Bb F Bb F Bb F Bb C F C F C A Bb F C A Bb F C A Bb Gm F Bb F Bb F Bb F Bb C A Bb Gm F"	"Looking for changes Tab by Paul McCartney - E-Chords"	"cifra/idmusica/81208/keyb/true.htm"
"G7 C7 D7 C7 G7 C7 C7 C7 D7 C7 G7"	"Lucille Tab by Paul McCartney - E-Chords"	"cifra/idmusica/134506/keyb/true.htm"
"Fmaj7 Am C Fmaj7 Am Em G Dm G Fmaj7 Am C Fmaj7 Am Em G Dm G C Fmaj7 C Fmaj7 C Fmaj7 C Dm7 G Fmaj7 Am F C"	"Magic Tab by Paul McCartney - E-Chords"	"cifra/idmusica/11161/keyb/true.htm"
"Amaj7 A6 A D A E A A C C/B Am Am/G D/F# Dm7 C C C/B Am Am/G D/F# F F C C/B Am Am/G D/F# Dm/F C C/G C C/B Am Am/G D/F# Dm/F F C C/B G C E Am D Dm7 G7 F C Em Am Am/G D/F# Dm/F C C/G C Em Am Am/G D/F# F C C/B"	"Mamunia Tab by Paul McCartney - E-Chords"	"cifra/idmusica/11180/keyb/true.htm"
"A A D A E D A E"	"Matchbox Tab by Paul McCartney - E-Chords"	"cifra/idmusica/134508/keyb/true.htm"
"D/F# Dm/F Em7 A7 Bb F C G Bb F C Bb F C G Bb F Ab Eb C D Dmaj7 D7 G D D Dmaj7 D7 G D/F# Dm/F Em7 A7"	"Maybe I'm Amazed Tab by Paul McCartney - E-Chords"	"cifra/idmusica/11181/keyb/true.htm"
"Bb F C G Bb F C Bb F C G Bb F Ab G C D Dmaj7 Ddim7 G D D Dmaj7 Ddim7 G D Bb F C G Bb F C E Bb F C G Bb F Ab G C"	"Maybe Im amazed Tab by Paul McCartney - E-Chords"	"cifra/idmusica/77379/keyb/true.htm"
"D G D A D G D A D G D A D"	"Midnight Special Tab by Paul McCartney - E-Chords"	"cifra/idmusica/134509/keyb/true.htm"
"G7 B7 Em B7 D7 Gm A7 Dm Gm C Gm A7 D D#º Em A D D#º Em Cm6 G7 Cm6 G7 Em Cm6 G7"	"Mistress And Maid Tab by Paul McCartney - E-Chords"	"cifra/idmusica/134510/keyb/true.htm"
"Cm Gm7 G7 Cm Gm7 G7 Cm Fm Cm Cm Fm Cm Cm Cm7 Am7 Ab7 G7 Cm Gm7 G7 Cm Gm7 G7 Cm Cm Cm Fm Ab7 G7 Cm Fm Cm Fm Cm Fm Cm Ab7 G7 Cm Fm Cm Cm"	"Monkberry Moon Delight Tab by Paul McCartney - E-Chords"	"cifra/idmusica/134511/keyb/true.htm"
"D D4 D D D4 D Bm Bm7/A E A D/A A D/A A D/A A D/A D F/D G/D D D4 D Bm Bm7/A E A D/A A D/A A D/A A D/A D F/D G/D D D D7M D7 G Gm D C D C D C D C D"	"Mother Nature's Son Tab by Paul McCartney - E-Chords"	"cifra/idmusica/31325/keyb/true.htm"
"A Bm Bm D A D D7 G A D Bm Bm D A D D7 G A F#m F#m G A G A G A G A D Bbaug Bm Bbaug D Bbaug A Bm A Bm Bm D A D D7 G A D Bm Bm D A D D7 G A F#m F#m G A G A G A G A D Bbaug Bm Bbaug D Bbaug C G Bm G Bm A D Bbaug Bm Bbaug D Bbaug Bm Bbaug D Bbaug A Bm A Bm"	"Motor of love Tab by Paul McCartney - E-Chords"	"cifra/idmusica/76848/keyb/true.htm"
"Am Am/G Am/F# Am/F E A F#m G A D E D E D E A A F#m G A D E D E E A Am Am/G Am/F# Am/F Am Am/G Am/F# Am/F D Bm G A D Bm G A D Bm C D D Bm C D G A G A G A D"	"Move Over Busker Tab by Paul McCartney - E-Chords"	"cifra/idmusica/134512/keyb/true.htm"
"E E A B7 E E A B7 E E A B7 E E A B7 E E A B7 E E A B7 E D G C D7 G G C D7 G G C D7 G G C D7 G G C D7 G G C D7 G G"	"Movie Magg Tab by Paul McCartney - E-Chords"	"cifra/idmusica/90595/keyb/true.htm"
