"E5 G E5 G E5 G E5 G E5 G E5 G E5 G E5 G C# G# F# C# G# F# E5 A5 C5 E5 G E5 G E5 G E5 G E5 A5 C5 E5 G E5 G E5 G E5 G E5 G E5 G E5 G E5 G"	"Torn Tab by Nirvana - E-Chords"	"cifra/idmusica/90365/keyb/true.htm"
"F A A# F# F A A# F# F A A# F# F A A# F# F A A# F# F F A A# F# F A A# F# F A A# F# F A A# F# F F A A# F# F A A# F# F A A# F# F"	"Tourette's (new Version) Tab by Nirvana - E-Chords"	"cifra/idmusica/67797/keyb/true.htm"
"A B C B A A B C A F G F G A C A C F G A C F G F G A C A C F G A C F G"	"Vaginas bite me Tab by Nirvana - E-Chords"	"cifra/idmusica/86329/keyb/true.htm"
"G A G A F# G A G A G A F# G A G A F# G A F# G A F# G A F# G A G A"	"Very Ape Tab by Nirvana - E-Chords"	"cifra/idmusica/16369/keyb/true.htm"
"E5 E F# G E A G B B/F# E5 E5 A G B B/F# E5 E5 A G B B/F# E5"	"Where Did U Sleep Last Night Tab by Nirvana - E-Chords"	"cifra/idmusica/149665/keyb/true.htm"
"E5 E F# G E A G B B/F# E5 E A G B B/F# E E A G B B/F# E"	"Where Did You Sleep Last Night Tab by Nirvana - E-Chords"	"cifra/idmusica/4110/keyb/true.htm"
"E5 A G B B/F# E5 E F# G E A G B B/F# E5 E5 A G B B/F# E5 E5 A G B B/F# E5"	"Where did you sleep last night (Ver.2) Tab by Nirvana - E-Chords"	"cifra/idmusica/74690/keyb/true.htm"
"Em Am G B7 Em Em Am G B7 Em Em Am G B7 Em Em Am G B7 Em Em Am G B7 Em Em Am G B7 Em Am G B7 Em"	"Where did you sleep last night? Tab by Nirvana - E-Chords"	"cifra/idmusica/76564/keyb/true.htm"
"Em C D Em C D Em C D D E Em C D Em C D Em C D D E"	"You know you're right Tab by Nirvana - E-Chords"	"cifra/idmusica/4118/keyb/true.htm"
"Em F#m Em F#m Em F#m Em F#m Em F#m A B A B Em F#m Em F#m Em F#m Em F#m A B A B A B Em F#m Em F#m Em F#m Em F#m Em F#m A A A A Em F#m Em F#m Em F#m Em F#m A B A B Em F#m A Bm"	"You know you're rigth Tab by Nirvana - E-Chords"	"cifra/idmusica/88271/keyb/true.htm"
